### ISSUE TITLE
SP 4.3.0 Siddhi http(sink ) map-xml overwrites customized 'content-type' header 

### ISSUE THREAD

**Issue by jing-zhou** [wso2-extensions/siddhi-map-xml#36]
**Description:**

SP 4.3.0, combination of http(sink) and  map-xml overwrites customized 'content-type' header
**Suggested Labels:**

**Suggested Assignees:**

**Affected Product Version:**

**OS, DB, other environment details and versions:**    
Stream Processor 4.3.0
**Steps to reproduce:**
I was trying to compose a SOAP message over  http (sink) + map-xml, so that a WSDL operation can be called at an endpoint from the Stream Processor . 
below are my Siddhi code 

```
@App:name("itee")
@App:description("gate -> bps: require")

define function soap[javascript] return string {
    var device = data[0];
    var process = data[1];
    var session = data[2];
    var gateway = data[3];
    var bucket = data[4];

    var resp =
        '<?xml version="1.0" encoding="UTF-8"?>' +
        '<soapenv:Envelope xmlns:soapenv="http://schemas.xmlsoap.org/soap/envelope/" xmlns:bps="http://gubnoi.com/bps">' +
            '<soapenv:Header/>' +
            '<soapenv:Body>' +
                '<bps:GupsRequest>' +
                    '<bps:device>' +
                        device +
                    '</bps:device>' +
                    '<bps:process>' +
                        process +
                    '</bps:process>' +
                    '<bps:session>' +
                        session +
                    '</bps:session>' +
                    '<bps:gateway>' +
                        gateway +
                    '</bps:gateway>' +
                    '<bps:bucket>' +
                        bucket +
                    '</bps:bucket>' +
                '</bps:GupsRequest>' +
            '</soapenv:Body>' +
        '</soapenv:Envelope>';

    return resp;
};

@source(type='wso2event', wso2.stream.id='itee:1.0.0', @map(type='wso2event'))
Define stream gate (meta_device string, correlation_process string, correlation_session string, correlation_gateway string, bucket string);

@sink(type='http', method='POST',
headers="'content-type:text/xml; charset=utf-8','SOAPAction:http://gubnoi.com/bps/process'",
publisher.url='http://bps.gubnoi.com:9763/services/Gups/',
@map(type='xml', @payload('{{payload}}')))
define stream bps (payload String);

@info(name='query1')
from gate
select soap(meta_device, correlation_process, correlation_session, correlation_gateway, bucket) as payload
insert into bps;
```
you can see that i had customized the headers as per SOAP messge specification

> headers="'content-type:text/xml; charset=utf-8','SOAPAction:http://gubnoi.com/bps/process'"

I uploaded the Siddhi in Stream Processor (4.3.0), and captured the corresponding http message by "tcpdump" 

I got the following http message logs 

```
16:07:03.061026 IP 10.0.0.206.36972 > bps.gubnoi.com.9763: Flags [P.], seq 1:709, ack 1, win 229, options [nop,nop,TS val 2886514 ecr 2909202], length 708
E....U@.@.,.
...
....l&#...#w..............
.,.r.,d.POST /services/Gups/ HTTP/1.1
SOAPAction: http://gubnoi.com/bps/process
Content-Type: application/xml
HTTP_METHOD: POST
connection: keep-alive
forwarded: by=10.0.0.206; proto=http
content-length: 499

<?xml version="1.0" encoding="UTF-8"?><soapenv:Envelope xmlns:soapenv="http://schemas.xmlsoap.org/soap/envelope/" xmlns:bps="http://gubnoi.com/bps"><soapenv:Header/><soapenv:Body><bps:GupsRequest><bps:device>51a3ccfe-8853-4d7a-ac5e-2c44562e647f</bps:device><bps:process>kur3z8z5</bps:process><bps:session>e09ea42c-61cf-478b-8417-15335f599177</bps:session><bps:gateway>b89d88c8-e80e-411d-8511-27c4c6eef639</bps:gateway><bps:bucket>null</bps:bucket></bps:GupsRequest></soapenv:Body></soapenv:Envelope>
16:07:03.061598 IP bps.gubnoi.com.9763 > 10.0.0.206.36972: Flags [.], ack 709, win 238, options [nop,nop,TS val 2909203 ecr 2886514], length 0
E..4..@.@.Cv
...
...&#.lw..................
.,d..,.r
16:07:03.065629 IP bps.gubnoi.com.9763 > 10.0.0.206.36972: Flags [P.], seq 1:146, ack 709, win 238, options [nop,nop,TS val 2909204 ecr 2886514], length 145
E.....@.@.B.
...
...&#.lw..................
.,d..,.rHTTP/1.1 400 Bad Request
Transfer-Encoding: chunked
Date: Tue, 04 Dec 2018 08:18:39 GMT
Connection: close
Server: WSO2 Carbon Server

0
```

you can see that I got a 

> Content-Type: application/xml

which caused the SOAP message to be rejected by the endpoint 

I also copied here a  log of a successful call by the same SOAP message from 'SoapUI'

```
17:12:53.397113 IP 10.0.0.104.59010 > 10.0.0.203.9763: Flags [P.], seq 1:264, ack 1, win 229, options [nop,nop,TS val 2379297107 ecr 3722593], length 263
E..;..@.@...
..h
.....&#{.:.E.h$.....~.....
..1S.8.aPOST /services/Gups/ HTTP/1.1
Accept-Encoding: gzip,deflate
Content-Type: text/xml;charset=UTF-8
SOAPAction: "http://gubnoi.com/bps/process"
Content-Length: 535
Host: 10.0.0.203:9763
Connection: Keep-Alive
User-Agent: Apache-HttpClient/4.1.1 (java 1.5)


17:12:53.397132 IP 10.0.0.203.9763 > 10.0.0.104.59010: Flags [.], ack 264, win 235, options [nop,nop,TS val 3722595 ecr 2379297107], length 0
E..4.F@.@..K
...
..h&#..E.h${.;......Y.....
.8.c..1S
17:12:53.400401 IP 10.0.0.104.59010 > 10.0.0.203.9763: Flags [P.], seq 264:799, ack 1, win 229, options [nop,nop,TS val 2379297110 ecr 3722595], length 535
E..K..@.@...
..h
.....&#{.;.E.h$....T .....
..1V.8.c<soapenv:Envelope xmlns:soapenv="http://schemas.xmlsoap.org/soap/envelope/" xmlns:bps="http://gubnoi.com/bps">
   <soapenv:Header/>
   <soapenv:Body>
      <bps:GupsRequest>
         <bps:device>51a3ccfe-8853-4d7a-ac5e-2c44562e647f</bps:device>
         <bps:gateway>b89d88c8-e80e-411d-8511-27c4c6eef639</bps:gateway>
         <bps:session>e09ea42c-61cf-478b-8417-15335f599177</bps:session>
         <bps:process>kur3z8z5</bps:process>
         <bps:bucket>?</bps:bucket>
      </bps:GupsRequest>
   </soapenv:Body>
</soapenv:Envelope>
17:12:53.400430 IP 10.0.0.203.9763 > 10.0.0.104.59010: Flags [.], ack 799, win 243, options [nop,nop,TS val 3722595 ecr 2379297110], length 0
E..4.G@.@..J
...
..h&#..E.h${.=......Y.....
.8.c..1V
17:12:53.408635 IP 10.0.0.203.9763 > 10.0.0.104.59010: Flags [P.], seq 1:329, ack 799, win 243, options [nop,nop,TS val 3722598 ecr 2379297110], length 328
E..|.H@.@...
...
..h&#..E.h${.=............
.8.f..1VHTTP/1.1 202 Accepted
X-Frame-Options: DENY
X-Content-Type-Options: nosniff
X-XSS-Protection: 1; mode=block
Set-Cookie: JSESSIONID=BFDE12961EFDFEE5C231C09DB4099545; Path=/; Secure; HttpOnly
Content-Type: text/xml;charset=UTF-8
Transfer-Encoding: chunked
Date: Tue, 04 Dec 2018 09:12:53 GMT
Server: WSO2 Carbon Server


17:12:53.412823 IP 10.0.0.104.59010 > 10.0.0.203.9763: Flags [.], ack 329, win 237, options [nop,nop,TS val 2379297123 ecr 3722598], length 0
E..4..@.@...

```
**Related Issues:**

**Comment by Niveathika92** [comment]
@jing-zhou We have identified the bug and fixed the siddhi-io-http extension. 

To apply the fix delete siddhi-io-http-*.jar in {SP_HOME}/lib folder and add the latest [1.0.43](https://github.com/wso2-extensions/siddhi-io-http/releases/tag/v1.0.43) version of the extension. You can download the latest extension from [Maven central](http://central.maven.org/maven2/org/wso2/extension/siddhi/io/http/siddhi-io-http/1.0.43/)

**Comment by Niveathika92** [comment]
@jing-zhou I am closing this as this is fixed, please feel free to reopen if you face any issues.
